[
  {
    "id": "imba",
    "name": "iMBA (Online Master of Business Administration)",
    "type": "online",
    "level": "graduate",
    "department": "business-administration",
    "description": "The iMBA program at Gies College of Business is a fully online MBA program that combines cutting-edge curriculum with flexible delivery. Ranked #1 Online MBA by U.S. News & World Report.",
    "url": "https://giesbusiness.illinois.edu/imba",
    "admissions": {
      "requirements": [
        "Bachelor's degree from accredited institution",
        "GMAT or GRE score",
        "Professional experience recommended",
        "English proficiency (TOEFL/IELTS for international students)"
      ],
      "applicationDeadlines": {
        "fall": "April 15",
        "spring": "October 15"
      },
      "applicationUrl": "https://giesbusiness.illinois.edu/imba/admissions"
    },
    "tuition": "$22,000-28,000 total program cost",
    "duration": "24-36 months",
    "format": "100% online, asynchronous",
    "rankings": [
      "#1 Online MBA (U.S. News & World Report)"
    ],
    "highlights": [
      "No GMAT/GRE required for some applicants",
      "Specializations in Finance, Digital Marketing, Strategy",
      "Global network of students and alumni",
      "Same degree as on-campus MBA"
    ],
    "lastUpdated": "2025-11-19T23:29:41.320311"
  },
  {
    "id": "imsa",
    "name": "iMSA (Master of Science in Accountancy)",
    "type": "online",
    "level": "graduate",
    "department": "accountancy",
    "description": "The iMSA is a fully online Master of Science in Accountancy program designed for aspiring CPAs and accounting professionals. Learn from top-ranked faculty.",
    "url": "https://giesbusiness.illinois.edu/imsa",
    "admissions": {
      "requirements": [
        "Bachelor's degree",
        "Accounting prerequisites",
        "GMAT/GRE waived for qualified applicants"
      ],
      "applicationDeadlines": {
        "fall": "May 1",
        "spring": "November 1"
      },
      "applicationUrl": "https://giesbusiness.illinois.edu/imsa/admissions"
    },
    "tuition": "$19,000-23,000 total program cost",
    "duration": "18-24 months",
    "format": "100% online",
    "rankings": [
      "#1 Accounting Program (U.S. News)"
    ],
    "highlights": [
      "CPA exam preparation",
      "Tax and audit specializations",
      "Flexible online format",
      "Top-ranked faculty"
    ],
    "lastUpdated": "2025-11-19T23:29:41.320313"
  },
  {
    "id": "imsm",
    "name": "iMSM (Master of Science in Management)",
    "type": "online",
    "level": "graduate",
    "department": "business-administration",
    "description": "The iMSM is designed for recent graduates and early-career professionals looking to accelerate their business careers with advanced management skills.",
    "url": "https://giesbusiness.illinois.edu/imsm",
    "admissions": {
      "requirements": [
        "Bachelor's degree",
        "No business background required",
        "GMAT/GRE optional"
      ],
      "applicationDeadlines": {
        "fall": "June 1",
        "spring": "December 1"
      },
      "applicationUrl": "https://giesbusiness.illinois.edu/imsm/admissions"
    },
    "tuition": "$18,000-22,000 total program cost",
    "duration": "12-18 months",
    "format": "100% online",
    "rankings": [],
    "highlights": [
      "No prior business degree required",
      "Fast-track career advancement",
      "Leadership and strategy focus",
      "Global peer network"
    ],
    "lastUpdated": "2025-11-19T23:29:41.320315"
  },
  {
    "id": "accountancy-bs",
    "name": "Bachelor of Science in Accountancy",
    "type": "on-campus",
    "level": "undergraduate",
    "department": "accountancy",
    "description": "The undergraduate Accountancy program at Gies is consistently ranked #1 in the nation, preparing students for successful careers in public accounting, corporate finance, and consulting.",
    "url": "https://giesbusiness.illinois.edu/programs/undergraduate/accountancy",
    "admissions": {
      "requirements": [
        "High school diploma or equivalent",
        "SAT/ACT scores",
        "Strong mathematics background",
        "Application through Illinois Admissions"
      ],
      "applicationDeadlines": {
        "fall": "November 1 (Early Action), January 5 (Regular)"
      },
      "applicationUrl": "https://admissions.illinois.edu"
    },
    "tuition": "Varies by residency status",
    "duration": "4 years",
    "format": "On-campus, full-time",
    "rankings": [
      "#1 Undergraduate Accounting (Public Accounting Report)"
    ],
    "highlights": [
      "150 credit hours for CPA eligibility",
      "Big 4 recruiting partnerships",
      "Professional development programs",
      "Study abroad opportunities"
    ],
    "lastUpdated": "2025-11-19T23:29:41.320317"
  },
  {
    "id": "finance-bs",
    "name": "Bachelor of Science in Finance",
    "type": "on-campus",
    "level": "undergraduate",
    "department": "finance",
    "description": "The Finance program provides comprehensive training in corporate finance, investments, and financial markets, preparing students for careers in investment banking, corporate finance, and asset management.",
    "url": "https://giesbusiness.illinois.edu/programs/undergraduate/finance",
    "admissions": {
      "requirements": [
        "High school diploma",
        "SAT/ACT scores",
        "Strong quantitative skills"
      ],
      "applicationDeadlines": {
        "fall": "November 1 (Early Action), January 5 (Regular)"
      },
      "applicationUrl": "https://admissions.illinois.edu"
    },
    "tuition": "Varies by residency status",
    "duration": "4 years",
    "format": "On-campus, full-time",
    "rankings": [
      "#12 Undergraduate Business Program (U.S. News)"
    ],
    "highlights": [
      "Bloomberg Terminal access",
      "Trading simulation labs",
      "CFA exam preparation",
      "Wall Street recruiting"
    ],
    "lastUpdated": "2025-11-19T23:29:41.320325"
  },
  {
    "id": "mba",
    "name": "MBA (Master of Business Administration)",
    "type": "on-campus",
    "level": "graduate",
    "department": "business-administration",
    "description": "The full-time MBA program at Gies offers a transformative educational experience with specialized concentrations, global immersion opportunities, and strong career outcomes.",
    "url": "https://giesbusiness.illinois.edu/mba",
    "admissions": {
      "requirements": [
        "Bachelor's degree",
        "GMAT or GRE",
        "3-5 years work experience recommended",
        "Essays and recommendations"
      ],
      "applicationDeadlines": {
        "round1": "October 15",
        "round2": "January 5",
        "round3": "March 15"
      },
      "applicationUrl": "https://giesbusiness.illinois.edu/mba/admissions"
    },
    "tuition": "$30,000-40,000 per year",
    "duration": "2 years",
    "format": "On-campus, full-time",
    "rankings": [
      "Top 50 MBA Program (Various Rankings)"
    ],
    "highlights": [
      "Specializations available",
      "Global immersion experiences",
      "Strong ROI",
      "Consulting and tech recruiting"
    ],
    "lastUpdated": "2025-11-19T23:29:41.320326"
  },
  {
    "id": "msf",
    "name": "MSF (Master of Science in Finance)",
    "type": "on-campus",
    "level": "graduate",
    "department": "finance",
    "description": "The MSF program offers advanced training in finance for recent graduates and early-career professionals seeking quantitative and analytical skills for finance careers.",
    "url": "https://giesbusiness.illinois.edu/msf",
    "admissions": {
      "requirements": [
        "Bachelor's degree",
        "Strong quantitative background",
        "GMAT/GRE",
        "0-2 years work experience"
      ],
      "applicationDeadlines": {
        "round1": "November 1",
        "round2": "February 1"
      },
      "applicationUrl": "https://giesbusiness.illinois.edu/msf/admissions"
    },
    "tuition": "$35,000-45,000 total program",
    "duration": "12-18 months",
    "format": "On-campus, full-time",
    "rankings": [],
    "highlights": [
      "CFA curriculum alignment",
      "Quantitative focus",
      "Investment banking recruiting",
      "Trading simulations"
    ],
    "lastUpdated": "2025-11-19T23:29:41.320328"
  }
]